{
  "$schema": "./preapproval.schema.json",
  "schemaVersion": "2.0.0",
  "preapprovalId": "phase-2-issue-72-removal-v2",
  "decisionState": "owner-approval-required",
  "auditedCommit": "33ffbbf0be3167a3bb11eb1093cef0643769a505",
  "auditedTree": "f306b45f8a8c76a6fb73ed3e45e0103d1889955d",
  "removalPlanSha256": "e986cbfbe3549fa033b218ab226cceb8acf0107d3b8995369b13e617547c1ece",
  "trustRoots": {
    "v1Census": "contracts/repository-removal/v1/census.json",
    "v1CensusSchema": "contracts/repository-removal/v1/census.schema.json",
    "v1CheckOutputSchema": "contracts/repository-removal/v1/check-output.schema.json",
    "v1EvidenceReceipt": "contracts/repository-removal/v1/evidence-receipt.json",
    "v1EvidenceReceiptSchema": "contracts/repository-removal/v1/evidence-receipt.schema.json",
    "v1HistoricalAllowlist": "contracts/repository-removal/v1/historical-allowlist.json",
    "v1HistoricalAllowlistPreapproval": "contracts/repository-removal/v1/historical-allowlist.preapproval.json",
    "v1HistoricalAllowlistSchema": "contracts/repository-removal/v1/historical-allowlist.schema.json",
    "v1Inventory": "contracts/repository-removal/v1/inventory.json",
    "v1InventorySchema": "contracts/repository-removal/v1/inventory.schema.json",
    "v1OwnerDecision": "contracts/repository-removal/v1/owner-decision.json",
    "v1OwnerDecisionSchema": "contracts/repository-removal/v1/owner-decision.schema.json",
    "v1Validator": "scripts/repository/validate_removal_approval.py",
    "v2OwnerDecisionSchema": "contracts/repository-removal/v2/owner-decision.schema.json",
    "v2ApplicationReceiptSchema": "contracts/repository-removal/v2/application-receipt.schema.json",
    "v2PlanSchema": "contracts/repository-removal/v2/removal-plan.schema.json",
    "v2PreapprovalSchema": "contracts/repository-removal/v2/preapproval.schema.json",
    "v2Validator": "scripts/repository/validate_removal_plan_v2.py"
  },
  "trustRootSha256": {
    "v1Census": "93d5bc30dabc2cf670e9a777e41eb5b604679d86c4e34bd41ad30b9f0fd6a7d6",
    "v1CensusSchema": "097ef5e853716a107ad2ca48d2aa8ad1861a954c359962f0a3d7cb330a521fb6",
    "v1CheckOutputSchema": "ff735cefbe61adf5188ae0bf3d3b57ff987c116e661106176c1a8f40b24a5d3e",
    "v1EvidenceReceipt": "cd62a361ab4ba467cb555f37b64b244dc15409a52283b87e20313ba211bced6b",
    "v1EvidenceReceiptSchema": "f5a45fc4948a91172fedd9b20554cba75a6011944b8383a3e9ebea721469f13c",
    "v1HistoricalAllowlist": "b44f1490f21f494e9768c01cc6b0dfdce1157fdd14c85a0646202fd93012e590",
    "v1HistoricalAllowlistPreapproval": "da0f8ea2bc8f0a71b6845adabdf552e68cc70b443ec6c997602a8e229cd33b66",
    "v1HistoricalAllowlistSchema": "92add4891c053b6a01ff1481ef9fcbc3a71a0d21e8e8f337281da1fed961a911",
    "v1Inventory": "6c22b7fbfd1e4686a85b1b8d47d88b710128476ad6adbfa48ff109f3ebbf0790",
    "v1InventorySchema": "8621afe8c0bfd1016819a8fd9b60eec82a09e8d055c732320442b9f24f9047de",
    "v1OwnerDecision": "5eb3412554ee6018fc1977a067373a18d3e67bc5e09e3da8ccf43c596034be34",
    "v1OwnerDecisionSchema": "cd66998c5c19247890b33679c6b313bf9cd50a565f9c0e29404d7fa1972acfab",
    "v1Validator": "6c5c47ddc02162967841c9234219840766ad2222518be8c48ee3ebe95df3d81e",
    "v2OwnerDecisionSchema": "7302e9a0a438dc1a4c29ad5c1c1d20ab3fa0ae48b010b53786568aa22ada7d58",
    "v2ApplicationReceiptSchema": "239a33a1ba8ee499433c00dde7d19e440fcf6a7921b6570afe45b17386fc1a15",
    "v2PlanSchema": "8f885e50a05440676a90e735a057722bf5e8455fadff0e91bf431ea9c9023aef",
    "v2PreapprovalSchema": "d0f2d8b7d1c651251a9df228de780510cafd5f3964ccba6ba31c843d232167b3",
    "v2Validator": "cd4b12227e13aa463b5477d25b756e75b6496f74787dddcc649cfc522cfd1738"
  },
  "ownerApprovalTemplate": "I approve the additive repository-removal v2 plan for issue #72 at preapproval commit <PREAPPROVAL_COMMIT>, preapproval SHA-256 <PREAPPROVAL_SHA256>, removal plan SHA-256 e986cbfbe3549fa033b218ab226cceb8acf0107d3b8995369b13e617547c1ece, and audited removal base 33ffbbf0be3167a3bb11eb1093cef0643769a505. This authorizes only the exact before/after path states and structural operations bound by that plan. It does not authorize Candidate-v7 or TAR inspection, copying, publication, or upload, and it does not authorize deletion or mutation of any external resource, credential, GitHub environment, or secret.",
  "safety": {
    "candidatePublicationAuthorized": false,
    "externalResourceMutationAuthorized": false
  }
}
